{
  "categories": [
    "ssn",
    "npi",
    "dea",
    "dob",
    "address",
    "account",
    "mrn",
    "name",
    "routingNumber",
    "ein",
    "itin",
    "creditCard",
    "email",
    "phone",
    "driversLicense",
    "passport",
    "licensePlate"
  ],
  "generated_by": "resecta_data.classifier.preset_thresholds",
  "notes": "Placeholder thresholds. The Phase 3b G9 sweep against Swift-side softmax dumps is designed to replace these values with calibrated ones; until then, the vectors reflect a rough conservative/balanced/aggressive posture rather than measured precision-recall behavior.",
  "presets": {
    "aggressive": {
      "account": 0.4,
      "address": 0.35,
      "creditCard": 0.85,
      "dea": 0.4,
      "dob": 0.4,
      "driversLicense": 0.65,
      "ein": 0.45,
      "email": 0.8,
      "itin": 0.5,
      "licensePlate": 0.5,
      "mrn": 0.4,
      "name": 0.35,
      "npi": 0.4,
      "passport": 0.65,
      "phone": 0.55,
      "routingNumber": 0.5,
      "ssn": 0.35
    },
    "balanced": {
      "account": 0.55,
      "address": 0.5,
      "creditCard": 0.88,
      "dea": 0.5,
      "dob": 0.55,
      "driversLicense": 0.72,
      "ein": 0.55,
      "email": 0.83,
      "itin": 0.65,
      "licensePlate": 0.65,
      "mrn": 0.55,
      "name": 0.5,
      "npi": 0.5,
      "passport": 0.72,
      "phone": 0.7,
      "routingNumber": 0.6,
      "ssn": 0.5
    },
    "conservative": {
      "account": 0.7,
      "address": 0.65,
      "creditCard": 0.9,
      "dea": 0.6,
      "dob": 0.7,
      "driversLicense": 0.75,
      "ein": 0.7,
      "email": 0.85,
      "itin": 0.78,
      "licensePlate": 0.8,
      "mrn": 0.7,
      "name": 0.65,
      "npi": 0.6,
      "passport": 0.75,
      "phone": 0.75,
      "routingNumber": 0.7,
      "ssn": 0.6
    }
  },
  "seed": 20260416,
  "status": "placeholder",
  "version": 1
}
